{
  "$schema": "https://json-schema.org/draft/2020-12/schema",
  "$id": "https://example.org/schemas/PrecinctCloseoutIndex.json",
  "title": "PrecinctCloseoutIndex",
  "type": "object",
  "additionalProperties": false,
  "required": [
    "index_id",
    "index_version",
    "generated_at",
    "election_scope",
    "entries"
  ],
  "properties": {
    "index_id": {
      "type": "string",
      "description": "Stable identifier for this closeout index series (updates may chain via previous_index_sha256)."
    },
    "index_version": {
      "type": "string",
      "pattern": "^[0-9]+\\.[0-9]+$",
      "description": "Schema version of this index payload."
    },
    "generated_at": {
      "type": "string",
      "format": "date-time",
      "description": "When this index payload was generated (best effort)."
    },
    "election_scope": {
      "type": "object",
      "additionalProperties": false,
      "required": [
        "election_id",
        "jurisdiction"
      ],
      "properties": {
        "election_id": {
          "type": "string"
        },
        "jurisdiction": {
          "type": "string"
        },
        "notes": {
          "type": "string"
        }
      }
    },
    "expected_set_sha256": {
      "type": "string",
      "pattern": "^sha256:[0-9a-f]{64}$",
      "description": "Optional digest of the bytes that define the expected reporting-unit set (roster) used for completeness evaluation."
    },
    "previous_index_sha256": {
      "type": "string",
      "pattern": "^sha256:[0-9a-f]{64}$",
      "description": "Optional digest of the previous index payload in this series, for rollback/rewrites detection."
    },
    "entries": {
      "type": "array",
      "minItems": 0,
      "items": {
        "type": "object",
        "additionalProperties": false,
        "required": [
          "reporting_unit_id",
          "closeout_packet_manifest_sha256"
        ],
        "properties": {
          "reporting_unit_id": {
            "type": "string",
            "description": "Precinct/reporting-unit identifier as used by the jurisdiction."
          },
          "custody_anchor_sha256": {
            "type": "string",
            "pattern": "^sha256:[0-9a-f]{64}$",
            "description": "Optional digest anchoring the jurisdiction's physical ballot custody chain for this reporting unit (e.g., scanned chain-of-custody packet, seal log bundle)."
          },
          "closeout_packet_manifest_sha256": {
            "type": "string",
            "pattern": "^sha256:[0-9a-f]{64}$",
            "description": "Digest of the referenced closeout micro-packet manifest.json bytes."
          },
          "closeout_notice_sha256": {
            "type": "string",
            "pattern": "^sha256:[0-9a-f]{64}$",
            "description": "Optional digest of the PublicNotice envelope that announced this closeout packet (if available)."
          },
          "mirrors": {
            "type": "array",
            "items": {
              "type": "string"
            },
            "description": "Optional mirror URLs/URIs where the closeout packet can be fetched."
          },
          "status": {
            "type": "string",
            "enum": [
              "published",
              "missing",
              "late",
              "unknown"
            ],
            "description": "Optional status hint. Operator-issued indexes typically use 'published'; watcher-issued indexes may include 'missing'/'late'."
          },
          "notes": {
            "type": "string",
            "description": "Optional short note about this entry (avoid narratives)."
          }
        }
      }
    },
    "notes": {
      "type": "string",
      "description": "Optional short notes for operators/observers (avoid narratives)."
    }
  }
}
