{"election_scope":{"election_id":"E-EXAMPLE-COUNTY-2026-MUNI","jurisdiction":"J-EXAMPLE-COUNTY","notes":"Synthetic example only."},"entries":[{"closeout_notice_sha256":"sha256:1111111111111111111111111111111111111111111111111111111111111111","closeout_packet_manifest_sha256":"sha256:0000000000000000000000000000000000000000000000000000000000000000","custody_anchor_sha256":"sha256:ffffffffffffffffffffffffffffffffffffffffffffffffffffffffffffffff","mirrors":["packet:example-county/pct-001"],"notes":"Synthetic closeout entry.","reporting_unit_id":"PCT-001","status":"published"}],"expected_set_sha256":"sha256:dddddddddddddddddddddddddddddddddddddddddddddddddddddddddddddddd","generated_at":"2026-05-21T12:00:00Z","index_id":"CLOSEOUT-INDEX-EXAMPLE-001","index_version":"1.0","notes":"Synthetic closeout index; not a live results publication.","previous_index_sha256":"sha256:eeeeeeeeeeeeeeeeeeeeeeeeeeeeeeeeeeeeeeeeeeeeeeeeeeeeeeeeeeeeeeee"}